{"schema_version":"coh.deployment-profile/v1","contract_version":"1.0.0","change":{"organization_id":"0198d6c4-0b68-7c4f-908d-bb21b4e5ac9e","actor_id":"0198d6c4-1111-7111-8111-111111111111","revision":1,"previous_config_digest":""},"deployment":{"kind":"native_workstation","os":"darwin","arch":"arm64"},"services":{"storage":"sqlite","workflow":"temporal_development_persistent","authentication":"local","transport_security":"loopback","evidence_store":"local"},"isolation":{"listen_scope":"loopback","docker_required":false,"docker_socket_mounted":false,"database_public":false,"workflow_public":false,"secrets_in_environment":false},"connectivity":{"mode":"air_gapped","endpoint_references":[],"dns_allowed":false,"internet_allowed":false,"telemetry_allowed":false,"updates_allowed":false,"external_time_allowed":false},"identities":{"control_plane":"cohd.local","workflow":"","database":""},"compose":{"enabled":false,"provider":"","image_digests":{},"migrations_run":false,"validators_run":false},"air_gap":{"bundle_manifest_digest":"sha256:aaaaaaaaaaaaaaaaaaaaaaaaaaaaaaaaaaaaaaaaaaaaaaaaaaaaaaaaaaaaaaaa","signed_packages":true,"oci_archives":true,"policies":true,"validators":true,"sboms":true,"provenance":true,"offline_feeds":true,"verification_tools":true}}
