{"schema_version":"coh.deployment-profile/v1","contract_version":"1.0.0","change":{"organization_id":"0198d6c4-0b68-7c4f-908d-bb21b4e5ac9e","actor_id":"0198d6c4-1111-7111-8111-111111111111","revision":1,"previous_config_digest":""},"deployment":{"kind":"compose","os":"linux","arch":"amd64"},"services":{"storage":"postgresql_18","workflow":"temporal_production","authentication":"oidc","transport_security":"mtls","evidence_store":"configured"},"isolation":{"listen_scope":"private","docker_required":true,"docker_socket_mounted":false,"database_public":false,"workflow_public":false,"secrets_in_environment":false},"connectivity":{"mode":"air_gapped","endpoint_references":[],"dns_allowed":false,"internet_allowed":false,"telemetry_allowed":false,"updates_allowed":false,"external_time_allowed":false},"identities":{"control_plane":"cohd.service","workflow":"temporal.service","database":"postgresql.service"},"compose":{"enabled":true,"provider":"local.provider","image_digests":{"control_plane":"sha256:aaaaaaaaaaaaaaaaaaaaaaaaaaaaaaaaaaaaaaaaaaaaaaaaaaaaaaaaaaaaaaaa","postgresql":"sha256:aaaaaaaaaaaaaaaaaaaaaaaaaaaaaaaaaaaaaaaaaaaaaaaaaaaaaaaaaaaaaaaa","temporal":"sha256:aaaaaaaaaaaaaaaaaaaaaaaaaaaaaaaaaaaaaaaaaaaaaaaaaaaaaaaaaaaaaaaa","migrations":"sha256:aaaaaaaaaaaaaaaaaaaaaaaaaaaaaaaaaaaaaaaaaaaaaaaaaaaaaaaaaaaaaaaa","validator":"sha256:aaaaaaaaaaaaaaaaaaaaaaaaaaaaaaaaaaaaaaaaaaaaaaaaaaaaaaaaaaaaaaaa","provider":"sha256:aaaaaaaaaaaaaaaaaaaaaaaaaaaaaaaaaaaaaaaaaaaaaaaaaaaaaaaaaaaaaaaa"},"migrations_run":true,"validators_run":true},"air_gap":{"bundle_manifest_digest":"sha256:aaaaaaaaaaaaaaaaaaaaaaaaaaaaaaaaaaaaaaaaaaaaaaaaaaaaaaaaaaaaaaaa","signed_packages":true,"oci_archives":true,"policies":true,"validators":true,"sboms":true,"provenance":true,"offline_feeds":true,"verification_tools":true}}
